{
  "$schema": "https://json-schema.org/draft/2020-12/schema",
  "$id": "urn:research-os:contracts:v1:worker-request",
  "title": "WorkerRequest",
  "description": "Core-authorized Worker execution request. Authorization, budget, and targeting are first-class. Extensible arguments MUST NOT carry policy, authorization, Evidence, Finding, Approval, or budget truth. side_effect_level 3 is representable and denied by default in Core; this field is not policy.",
  "type": "object",
  "additionalProperties": false,
  "required": [
    "contract_version",
    "correlation",
    "worker_capability",
    "action",
    "target_reference",
    "authorization_decision_reference",
    "execution_budget",
    "side_effect_level",
    "secret_references",
    "arguments",
    "capability_version",
    "capability_definition_fingerprint"
  ],
  "properties": {
    "contract_version": {
      "const": "v1",
      "description": "Worker contract major. Not a domain lifecycle version."
    },
    "correlation": {
      "$ref": "urn:research-os:contracts:v1:correlation-context"
    },
    "worker_capability": {
      "type": "string",
      "minLength": 1,
      "description": "Capability name from the Tools contract (not a vendor product)."
    },
    "action": {
      "type": "string",
      "minLength": 1,
      "description": "Requested action within that capability."
    },
    "target_reference": {
      "type": "string",
      "minLength": 1,
      "description": "Opaque target reference already covered by the referenced Core decision. Not a scope grant."
    },
    "authorization_decision_reference": {
      "type": "string",
      "minLength": 1,
      "description": "Opaque reference to a Core authorization decision. This field is not the decision document."
    },
    "execution_budget": {
      "$ref": "urn:research-os:contracts:v1:execution-budget"
    },
    "side_effect_level": {
      "type": "integer",
      "enum": [0, 1, 2, 3],
      "description": "0 read-only/low, 1 minor/reversible, 2 approval-sensitive external state change, 3 destructive/high-impact (denied by default in Core)."
    },
    "secret_references": {
      "type": "array",
      "items": {
        "$ref": "urn:research-os:contracts:v1:secret-reference"
      },
      "description": "Minimum SecretReferences for this job. No secret values."
    },
    "arguments": {
      "type": "object",
      "additionalProperties": true,
      "description": "Job-specific extensible payload. MUST NOT embed authorization, budget authority, approval, scope state, Evidence, Finding, or promotion."
    },
    "capability_version": {
      "type": "string",
      "minLength": 1,
      "description": "Capability definition version bound at compile time. Not authorization."
    },
    "capability_definition_fingerprint": {
      "type": "string",
      "minLength": 1,
      "description": "SHA-256 fingerprint of allowlisted capability policy fields. Not authorization."
    },
    "resolved_secret_values": {
      "type": "object",
      "additionalProperties": { "type": "string" },
      "description": "Ephemeral secret values resolved at the execution boundary. MUST NOT be persisted in SoR, Observation, Evidence, or audit payloads."
    },
    "network_envelope": {
      "type": "object",
      "additionalProperties": false,
      "description": "Core-derived dispatch-time network bounds. Not a scope grant. Worker may only tighten.",
      "required": [
        "normalized_scheme",
        "normalized_host",
        "normalized_port",
        "document_path",
        "origin_wide",
        "allowed_path_prefixes",
        "denied_path_prefixes",
        "loopback_only",
        "source_scope_rule_ids"
      ],
      "properties": {
        "normalized_scheme": { "type": "string", "minLength": 1 },
        "normalized_host": { "type": "string", "minLength": 1 },
        "normalized_port": { "type": "integer", "minimum": 1 },
        "document_path": { "type": "string", "minLength": 1 },
        "origin_wide": { "type": "boolean" },
        "allowed_path_prefixes": {
          "type": "array",
          "items": { "type": "string", "minLength": 1 }
        },
        "denied_path_prefixes": {
          "type": "array",
          "items": { "type": "string", "minLength": 1 }
        },
        "loopback_only": { "type": "boolean" },
        "source_scope_rule_ids": {
          "type": "array",
          "items": { "type": "string", "minLength": 1 }
        },
        "authorization_decision_reference": { "type": "string", "minLength": 1 }
      }
    },
    "max_attempted_requests": {
      "type": "integer",
      "minimum": 1,
      "description": "Per-action attempted HTTP(S) request cap derived from remaining IssuedBudget intersect capability max. Not authorization."
    }
  }
}
