{
  "contract_version": "v1",
  "correlation": {
    "correlation_id": "corr-example",
    "research_run_id": "run-example",
    "experiment_id": "exp-example",
    "request_id": "req-example"
  },
  "worker_capability": "diagnostic.echo",
  "action": "echo",
  "target_reference": "target-example",
  "authorization_decision_reference": "authz-example",
  "execution_budget": {
    "budget_id": "budget-example",
    "max_requests": 1,
    "max_tool_calls": 1,
    "max_runtime_ms": 5000,
    "max_concurrency": 1
  },
  "side_effect_level": 0,
  "capability_version": "1",
  "capability_definition_fingerprint": "d86e9a66407367f2853f801a6f537d63dc264cc892c45036703081d806e5c98d",
  "secret_references": [],
  "arguments": {
    "message": "canonical-example"
  }
}
